{
  "schema_version": "2.0.0",
  "gate_id": "GATE-013",
  "gate_state": "GREEN",
  "decision_actor": "human",
  "recorded_at_utc": "2026-07-16T10:20:00Z",
  "implementation_revision": "git:0123456789abcdef0123456789abcdef01234567",
  "test_ids": ["TST-DEVICE-001"],
  "requirement_ids": ["OPS-DEVICE-001"],
  "adr_ids": ["ADR-002", "ADR-003"],
  "fixture_refs": [{"fixture_id": "FX-RRCAP-010S", "fixture_revision": "rev-001", "sha256": "aaaaaaaaaaaaaaaaaaaaaaaaaaaaaaaaaaaaaaaaaaaaaaaaaaaaaaaaaaaaaaaa"}],
  "environment": {
    "device_model": "iPhone 17",
    "os_version": "iOS 26.0",
    "xcode_version": "Xcode 26.0",
    "runtime_tier": "base-iphone",
    "capability_flags": {"camera_permission": "granted", "arkit_world_tracking": "pass", "plane_detection": "pass", "lidar_required": false},
    "signing_result": "pass"
  },
  "value_classification": "MEASURED",
  "evidence_artifacts": [
    {"opaque_artifact_id": "opaque-gate-013-run-0002", "artifact_kind": "automated_report", "artifact_role": "supporting_evidence", "sha256": "aaaaaaaaaaaaaaaaaaaaaaaaaaaaaaaaaaaaaaaaaaaaaaaaaaaaaaaaaaaaaaaa", "external_retention": true},
    {"opaque_artifact_id": "opaque-gate-013-attestation-0002", "artifact_kind": "ballot", "artifact_role": "operator_attestation", "sha256": "bbbbbbbbbbbbbbbbbbbbbbbbbbbbbbbbbbbbbbbbbbbbbbbbbbbbbbbbbbbbbbbb", "external_retention": true}
  ],
  "automated_report_sha256": "aaaaaaaaaaaaaaaaaaaaaaaaaaaaaaaaaaaaaaaaaaaaaaaaaaaaaaaaaaaaaaaa",
  "operator_checklist_sha256": "bbbbbbbbbbbbbbbbbbbbbbbbbbbbbbbbbbbbbbbbbbbbbbbbbbbbbbbbbbbbbbbb",
  "locked_decision_change_id": null,
  "prd_sha256": null,
  "affected_adr_sha256": []
}
