{"adr_ids":["ADR-004","ADR-013","ADR-014"],"affected_adr_sha256":[],"automated_report_sha256":null,"decision_actor":"automation","environment":{"capability_flags":{"arkit_world_tracking":"not_tested","camera_permission":"not_tested","lidar_required":false,"plane_detection":"not_tested"},"device_model":null,"os_version":"Darwin 25.5.0 arm64","runtime_tier":"local-deterministic-preflight","signing_result":"not_tested","xcode_version":"Xcode 26.4"},"evidence_artifacts":[{"artifact_kind":"automated_report","artifact_role":"supporting_evidence","external_retention":true,"opaque_artifact_id":"opaque-gate-001-automated-preflight","sha256":"d956d7f71c6152f309983ce2d1bf0cbd8f5798bc232ba8736d309df6975b82bf"}],"fixture_refs":[{"fixture_id":"FX-PREFLIGHT-CAPTURE-SHORT","fixture_revision":"rev-001","sha256":"56e2a84fc589f23e50c5803189aa2263acb376a56c28fcabe0675a6650c3230a"},{"fixture_id":"FX-PREFLIGHT-CAPTURE-LONG","fixture_revision":"rev-001","sha256":"a0ea7f7afbffaf59f7633384ca1a1a557b8a64b0d67f76dc4ea925cc928b5f98"}],"gate_id":"GATE-001","gate_state":"RUNNING","implementation_revision":"git:47f4816dc67334a8023939a7ad4d28973ec9b9fc","locked_decision_change_id":null,"operator_checklist_sha256":null,"prd_sha256":null,"recorded_at_utc":"2026-07-18T12:43:26Z","requirement_ids":["FR-CAPTURE-001","FR-B0-001","NFR-REPLAY-001","SEC-CONSENT-001"],"schema_version":"2.0.0","test_ids":["TST-CAPTURE-001","TST-REPLAY-001","TST-QUEUE-001"],"value_classification":"TARGET"}
