{
  "schema_version": "2.0.0",
  "gate_id": "GATE-002",
  "gate_state": "UNRUN",
  "decision_actor": "automation",
  "recorded_at_utc": "2026-07-16T10:00:00Z",
  "implementation_revision": "git:0123456789abcdef0123456789abcdef01234567",
  "test_ids": ["TST-COORD-001"],
  "requirement_ids": ["NFR-COORD-001"],
  "adr_ids": ["ADR-003"],
  "fixture_refs": [{"fixture_id": "FX-COORD-001", "fixture_revision": "rev-001", "sha256": "aaaaaaaaaaaaaaaaaaaaaaaaaaaaaaaaaaaaaaaaaaaaaaaaaaaaaaaaaaaaaaaa"}],
  "environment": {
    "device_model": null,
    "os_version": null,
    "xcode_version": null,
    "runtime_tier": "local-contract-runner",
    "capability_flags": {"camera_permission": "not_tested", "arkit_world_tracking": "not_tested", "plane_detection": "not_tested", "lidar_required": false},
    "signing_result": "not_tested"
  },
  "value_classification": "TARGET",
  "evidence_artifacts": [],
  "automated_report_sha256": null,
  "operator_checklist_sha256": null,
  "locked_decision_change_id": null,
  "prd_sha256": null,
  "affected_adr_sha256": []
}
