{
  "schema_version": "2.0.0",
  "gate_id": "GATE-006",
  "gate_state": "WAIVED_BY_HUMAN",
  "decision_actor": "human",
  "recorded_at_utc": "2026-07-16T10:30:00Z",
  "implementation_revision": "git:0123456789abcdef0123456789abcdef01234567",
  "test_ids": ["TST-REVEAL-001"],
  "requirement_ids": ["FR-REMOVE-001"],
  "adr_ids": ["ADR-001", "ADR-009"],
  "fixture_refs": [{"fixture_id": "FX-HERO-ROOM-001", "fixture_revision": "rev-001", "sha256": "aaaaaaaaaaaaaaaaaaaaaaaaaaaaaaaaaaaaaaaaaaaaaaaaaaaaaaaaaaaaaaaa"}],
  "environment": {
    "device_model": "iPhone 17",
    "os_version": "iOS 26.0",
    "xcode_version": "Xcode 26.0",
    "runtime_tier": "base-iphone",
    "capability_flags": {"camera_permission": "granted", "arkit_world_tracking": "pass", "plane_detection": "pass", "lidar_required": false},
    "signing_result": "pass"
  },
  "value_classification": "MEASURED",
  "evidence_artifacts": [
    {"opaque_artifact_id": "opaque-gate-006-run-0001", "artifact_kind": "metric_output", "artifact_role": "supporting_evidence", "sha256": "aaaaaaaaaaaaaaaaaaaaaaaaaaaaaaaaaaaaaaaaaaaaaaaaaaaaaaaaaaaaaaaa", "external_retention": true},
    {"opaque_artifact_id": "opaque-gate-006-attestation-0001", "artifact_kind": "ballot", "artifact_role": "operator_attestation", "sha256": "bbbbbbbbbbbbbbbbbbbbbbbbbbbbbbbbbbbbbbbbbbbbbbbbbbbbbbbbbbbbbbbb", "external_retention": true}
  ],
  "automated_report_sha256": "aaaaaaaaaaaaaaaaaaaaaaaaaaaaaaaaaaaaaaaaaaaaaaaaaaaaaaaaaaaaaaaa",
  "operator_checklist_sha256": "bbbbbbbbbbbbbbbbbbbbbbbbbbbbbbbbbbbbbbbbbbbbbbbbbbbbbbbbbbbbbbbb",
  "locked_decision_change_id": "OD-2026-001",
  "prd_sha256": "cccccccccccccccccccccccccccccccccccccccccccccccccccccccccccccccc",
  "affected_adr_sha256": [{"adr_id": "ADR-001", "sha256": "dddddddddddddddddddddddddddddddddddddddddddddddddddddddddddddddd"}, {"adr_id": "ADR-009", "sha256": "eeeeeeeeeeeeeeeeeeeeeeeeeeeeeeeeeeeeeeeeeeeeeeeeeeeeeeeeeeeeeeee"}]
}
